{
  "$schema": "https://json-schema.org/draft/2020-12/schema",
  "$id": "poi.schema.json",
  "title": "Neon Compass POI",
  "type": "object",
  "required": ["id", "category", "position", "title", "status", "sources"],
  "additionalProperties": false,
  "properties": {
    "id": { "type": "string", "pattern": "^poi_[a-z0-9_]+$" },
    "category": {
      "enum": ["landmark", "collectible", "activity", "safehouse", "vehicle", "event"]
    },
    "collection": { "type": "string", "pattern": "^[a-z0-9_]+$" },
    "mergedInto": { "type": "string", "pattern": "^poi_[a-z0-9_]+$" },
    "deleted": {
      "type": "boolean",
      "description": "Pierre tombale : annule l'entrée de même id du socle embarqué, qu'on ne peut pas retirer du binaire après coup."
    },
    "position": {
      "oneOf": [
        { "type": "null" },
        {
          "type": "object",
          "required": ["x", "y"],
          "additionalProperties": false,
          "properties": {
            "x": { "type": "number", "minimum": 0, "maximum": 1 },
            "y": { "type": "number", "minimum": 0, "maximum": 1 }
          }
        }
      ]
    },
    "title": { "$ref": "#/$defs/localized" },
    "note": { "$ref": "#/$defs/localized" },
    "status": { "enum": ["draft", "published"] },
    "sources": {
      "type": "array",
      "minItems": 1,
      "items": { "type": "string" }
    },
    "processedFrom": { "type": "string" }
  },
  "$defs": {
    "localized": {
      "type": "object",
      "required": ["en"],
      "additionalProperties": false,
      "properties": {
        "en": { "type": "string", "minLength": 1 },
        "fr": { "type": "string" },
        "es": { "type": "string" },
        "it": { "type": "string" },
        "de": { "type": "string" }
      }
    }
  }
}
