{
  "id": "poi_gtav_wall_breach_8930a64e",
  "category": "activity",
  "collection": "wall_breach",
  "position": {
    "x": 0.410156,
    "y": 0.564783
  },
  "title": {
    "en": "Franklins mansion",
    "fr": "Villa de Franklin"
  },
  "note": {
    "en": "Go to the location as seen below. Drive your car under the porch on the right if you are facing the mansion. Hop on top of it and climb up the roof. Pull out your phone and accept any pending job invite. Back out immedietly and you should spawn inside Franklins mansion.",
    "fr": "Rendez-vous à l'endroit indiqué. Garez votre voiture sous l'auvent de droite quand vous faites face à la villa. Montez dessus, puis grimpez sur le toit. Sortez votre téléphone, acceptez une invitation de mission en attente, puis annulez aussitôt : vous réapparaissez dans la villa de Franklin."
  },
  "status": "published",
  "sources": [
    "https://raw.githubusercontent.com/gta5-map/gta5-map.github.io/master/locations.json"
  ],
  "processedFrom": "gta5-map:wall_breach:33@X=71.42700,Y=-124.62900"
}
