{
  "id": "poi_gtav_knife_flight_185",
  "category": "activity",
  "position": {
    "x": 0.404622,
    "y": 0.658366
  },
  "title": {
    "en": "Knife Flight #4",
    "fr": "Vol en rase-mottes #4"
  },
  "status": "draft",
  "sources": [
    "https://raw.githubusercontent.com/danharper/GTAV/master/locations.json"
  ],
  "processedFrom": "danharper/GTAV#185"
}
