{
  "id": "poi_gtav_under_bridge_264",
  "category": "activity",
  "position": {
    "x": 0.189128,
    "y": 0.549967
  },
  "title": {
    "en": "Under the Bridge #39",
    "fr": "Passage sous pont #39"
  },
  "note": {
    "en": "The Buzzard helicopter is the easiest vehicle for all bridges - the blades are slightly shorter than the Maverick"
  },
  "status": "draft",
  "sources": [
    "https://raw.githubusercontent.com/danharper/GTAV/master/locations.json"
  ],
  "processedFrom": "danharper/GTAV#264"
}
