{
  "id": "poi_gtav_epsilon_tract_217",
  "category": "collectible",
  "position": {
    "x": 0.602214,
    "y": 0.703451
  },
  "title": {
    "en": "Epsilon Tract #2",
    "fr": "Tract Epsilon #2"
  },
  "note": {
    "en": "“Where the first one of the fleet succumbed to the waves, there the message is seeded”."
  },
  "status": "draft",
  "sources": [
    "https://raw.githubusercontent.com/danharper/GTAV/master/locations.json"
  ],
  "processedFrom": "danharper/GTAV#217"
}
