{
  "id": "poi_gtav_letter_scrap_140",
  "category": "collectible",
  "position": {
    "x": 0.477865,
    "y": 0.428385
  },
  "title": {
    "en": "Letter Scrap #9 - Grand Senora Desert",
    "fr": "Fragment de lettre #9 - Grand Senora Desert"
  },
  "note": {
    "en": "On the construction site is the shell of a circular gas structure. In the very centre on some grating with construction poles sticking out of it is this Letter."
  },
  "status": "draft",
  "sources": [
    "https://raw.githubusercontent.com/danharper/GTAV/master/locations.json"
  ],
  "processedFrom": "danharper/GTAV#140"
}
