{
  "id": "poi_gtav_gas_17",
  "category": "landmark",
  "position": {
    "x": 0.492395,
    "y": 0.628975
  },
  "title": {
    "en": "Gas Station",
    "fr": "Station-service"
  },
  "status": "draft",
  "sources": [
    "https://raw.githubusercontent.com/DurtyFree/gta-v-data-dumps/master/objectslocations/worldGasPumps.json"
  ],
  "processedFrom": "DurtyFree:gas#17"
}
