{
  "id": "poi_gtav_spaceship_part_cac8f06c",
  "category": "collectible",
  "collection": "spaceship_part",
  "position": {
    "x": 0.491862,
    "y": 0.791341
  },
  "title": {
    "en": "Spaceship Part #20 - El Burro Heights",
    "fr": "Pièce de vaisseau #20 - El Burro Heights",
    "es": "Pieza de nave #20 - El Burro Heights",
    "it": "Parte di astronave #20 - El Burro Heights",
    "de": "Raumschiffteil #20 - El Burro Heights"
  },
  "note": {
    "en": "In front of the freeway-supporting wall with the “VAGOS” graffiti on it is a sewer pipe that pumps water out to sea. Right next to the pipe opening is the Spaceship Part.",
    "fr": "Devant le mur de soutènement de l'autoroute couvert du tag « VAGOS », une canalisation d'égout se déverse vers la mer. La pièce est juste à côté de son embouchure."
  },
  "status": "published",
  "sources": [
    "https://raw.githubusercontent.com/danharper/GTAV/master/locations.json"
  ],
  "processedFrom": "danharper/GTAV:spaceship_part:51"
}
