{
  "id": "poi_gtav_stunt_jump_98",
  "category": "activity",
  "position": {
    "x": 0.423177,
    "y": 0.819336
  },
  "title": {
    "en": "Stunt Jump #17 - Elysian Island/Elysian Fields Fwy",
    "fr": "Saut cascade #17 - Elysian Island/Elysian Fields Fwy"
  },
  "status": "draft",
  "sources": [
    "https://raw.githubusercontent.com/danharper/GTAV/master/locations.json"
  ],
  "processedFrom": "danharper/GTAV#98"
}
