{
  "id": "poi_gtav_story_vehicle_51",
  "category": "vehicle",
  "position": {
    "x": 0.309896,
    "y": 0.601968
  },
  "title": {
    "en": "Western Daemon"
  },
  "note": {
    "en": "Go to the location as seen below. With a bit of luck it will spawn there."
  },
  "status": "draft",
  "sources": [
    "https://raw.githubusercontent.com/gta5-map/gta5-map.github.io/master/locations.json"
  ],
  "processedFrom": "gta5-map#51"
}
