{
  "id": "poi_gtav_under_bridge_ac500053",
  "category": "activity",
  "collection": "under_bridge",
  "position": {
    "x": 0.482747,
    "y": 0.664876
  },
  "title": {
    "en": "Under the Bridge #17",
    "fr": "Passage sous pont #17",
    "es": "Paso bajo puente #17",
    "it": "Passaggio sotto il ponte #17",
    "de": "Brückenunterquerung #17"
  },
  "note": {
    "en": "The Buzzard helicopter is the easiest vehicle for all bridges - the blades are slightly shorter than the Maverick",
    "fr": "Le Buzzard est l'hélicoptère le plus commode pour tous les ponts : ses pales sont un peu plus courtes que celles du Maverick.",
    "es": "El Buzzard es el helicóptero más cómodo para todos los puentes: sus palas son algo más cortas que las del Maverick.",
    "it": "Il Buzzard è l'elicottero più comodo per tutti i ponti: le sue pale sono un po' più corte di quelle del Maverick.",
    "de": "Der Buzzard ist der bequemste Helikopter für alle Brücken: Seine Rotorblätter sind etwas kürzer als die des Maverick."
  },
  "status": "published",
  "sources": [
    "https://raw.githubusercontent.com/danharper/GTAV/master/locations.json"
  ],
  "processedFrom": "danharper/GTAV:under_bridge:242"
}
