{
  "id": "poi_gtav_under_bridge_2387d429",
  "category": "activity",
  "collection": "under_bridge",
  "position": {
    "x": 0.414225,
    "y": 0.751139
  },
  "title": {
    "en": "Under the Bridge #32",
    "fr": "Passage sous pont #32"
  },
  "note": {
    "en": "The Buzzard helicopter is the easiest vehicle for all bridges - the blades are slightly shorter than the Maverick"
  },
  "status": "published",
  "sources": [
    "https://raw.githubusercontent.com/danharper/GTAV/master/locations.json"
  ],
  "processedFrom": "danharper/GTAV:under_bridge:257"
}
