{
  "id": "poi_gtav_gas_dfb364bd",
  "category": "landmark",
  "collection": "gas",
  "position": {
    "x": 0.368975,
    "y": 0.693075
  },
  "title": {
    "en": "Gas Station",
    "fr": "Station-service"
  },
  "status": "published",
  "sources": [
    "https://raw.githubusercontent.com/DurtyFree/gta-v-data-dumps/master/objectslocations/worldGasPumps.json"
  ],
  "processedFrom": "DurtyFree:gas:X=-549.9,Y=-1228.1"
}
