{
  "id": "poi_gtav_epsilon_car_212",
  "category": "vehicle",
  "position": {
    "x": 0.405111,
    "y": 0.569255
  },
  "title": {
    "en": "Pegassi Vacca"
  },
  "status": "draft",
  "sources": [
    "https://raw.githubusercontent.com/danharper/GTAV/master/locations.json"
  ],
  "processedFrom": "danharper/GTAV#212"
}
