{
  "id": "poi_gtav_wall_breach_76",
  "category": "activity",
  "position": {
    "x": 0.327311,
    "y": 0.751546
  },
  "title": {
    "en": "Airport LSC Wall-breach"
  },
  "note": {
    "en": "Go to the location as noted and stand behind the LSC. Park a car between the two shutter-doors that are directly right of the small crane. Climb onto the car you parked, face the wall and press Box to breach the wall."
  },
  "status": "draft",
  "sources": [
    "https://raw.githubusercontent.com/gta5-map/gta5-map.github.io/master/locations.json"
  ],
  "processedFrom": "gta5-map#76"
}
